47,K-004617,199400891,알콤정,일양약품(주),"이 약은 회충, 요충, 편충, 십이지장충의 감염 및 이들 혼합감염의 치료에 사용합니다.",성인 및 소아는 1정(500 mg)을 1회 복용합니다.,,"이 약에 과민증 환자, 임부는 이 약을 복용하지 마십시오. 이 약을 복용하기 전에 1세 미만의 영아, 임부 또는 임신하고 있을 가능성이 있는 여성 및 수유부는 의사 또는 약사와 상의하십시오.",,"드물게 일과성 구역, 복통, 설사, 발진, 두드러기, 혈관부종 등이 나타나는 경우 복용을 즉각 중지하고 의사 또는 약사와 상의하십시오.",습기와 빛을 피해 실온에서 보관하십시오. 어린이의 손이 닿지 않는 곳에 보관하십시오.,
48,K-004637,199401030,삼남아세트아미노펜정,삼남제약(주),"이 약은 감기로 인한 발열 및 동통(통증), 두통, 신경통, 근육통, 월경통, 염좌통(삔 통증)과 치통, 관절통, 류마티양 동통(통증)에 사용합니다.","성인은 1회 300~1,000 mg을 1일 3~4회 복용합니다. 1일 최고 4,000 mg까지 투여할 수 있습니다. 연령, 증상에 따라 적절히 증감합니다.","매일 세잔 이상 정기적 음주자가 이 약 또는 다른 해열진통제를 복용할 때는 의사 또는 약사와 상의하십시오. 간손상을 일으킬 수 있습니다. 매우 드물게 치명적일 수 있는 급성전신발진고름물집증, 스티븐스-존슨증후군, 독성표피괴사용해와 같은 중대한 피부반응이 보고되었고 이 약 복용 후 피부발진 또는 다른 과민반응의 징후가 나타나는 경우 즉시 복용을 중단하십시오. 아세트아미노펜으로 일일 최대 용량(4,000 mg)을 초과하여 복용하지 마십시오. 간손상을 일으킬 수 있습니다. 아세트아미노펜을 포함하는 다른 제품과 함께 복용하지 마십시오.","이 약에 과민증 환자, 소화성 궤양, 심한 혈액이상, 심한 간장애, 심한 신장장애, 심한 심장기능저하, 아스피린 천식(비스테로이드성 소염제에 의한 천식발작) 또는 경험자, 바르비탈계 약물, 삼환계 항우울제를 복용한 환자, 알코올을 복용한 사람은 이 약을 복용하지 마십시오. 이 약을 복용하기 전에 간장애 또는 경험자, 신장(콩팥)장애 또는 경험자, 소화성궤양의 경험자, 혈액이상 또는 경험자, 출혈경향이 있는 환자, 심장기능이상이 있는 환자, 과민증의 경험자, 기관지 천식 환자, 노인, 임부 또는 수유부는 의사 또는 약사와 상의하십시오.","아세트아미노펜을 포함하는 다른 제품, 바르비탈계 약물, 삼환계 항우울제, 알코올과 함께 복용하지 마십시오. 와파린, 리튬, 티아지드계 이뇨제, 다른 소염진통제와 함께 복용 시 의사 또는 약사와 상의하십시오.",,빛을 피해 실온에서 보관하십시오. 어린이의 손이 닿지 않는 곳에 보관하십시오.,
49,K-004799,199402278,타이레놀정,(주)한국얀센,"이 약은 감기로 인한 발열 및 동통(통증), 두통, 신경통, 근육통, 월경통, 염좌통(삔 통증)과 치통, 관절통, 류마티양 동통(통증)에 사용합니다.","만 12세 이하의 소아는 1회 권장용량을 4~6시간 마다 필요시 복용합니다. 이 약은 가능한 최단기간동안 최소 유효용량으로 복용하며, 1일 5회 (75 mg/kg)를 초과하여 복용하지 않습니다. 몸무게를 알 경우 몸무게에 따른 용량(10~15 mg/kg)으로 복용하는 것이 더 적절합니다. 연령대별 권장용량은 허가사항을 참고하십시오.","매일 세잔 이상 정기적 음주자가 이 약 또는 다른 해열진통제를 복용할 때는 의사 또는 약사와 상의하십시오. 간손상을 일으킬 수 있습니다. 매우 드물게 치명적일 수 있는 급성전신발진고름물집증, 스티븐스- 존슨증후군, 독성표피괴사용해와 같은 중대한 피부반응이 보고되었고 이 약 복용 후 피부발진 또는 다른 과민반응의 징후가 나타나는 경우 즉시 복용을 중단하십시오. 아세트아미노펜으로 일일 최대 용량(4,000 mg)을 초과하여 복용하지 마십시오. 간손상을 일으킬 수 있습니다. 아세트아미노펜을 포함하는 다른 제품과 함께 복용하지 마십시오.","이 약에 과민증 환자, 소화성궤양, 심한 혈액이상, 심한 간장애, 심한 신장장애, 심한 심장기능저하, 아스피린 또는 다른 소염진통제에 의한 천식 경험자, 바르비탈계 약물 또는 삼환계 항우울제를 복용한 환자, 알코올을 복용한 사람, 갈락토오스불내성, Lapp 유당분해효소 결핍증 또는 포도당-갈락토오스 흡수장애 등의 유전적인 문제가 있는 환자는 이 약을 복용하지 마십시오. 이 약을 복용하기 전에 간장애 또는 경험자, 신장(콩팥)장애 또는 경험자, 소화성궤양의 경험자, 혈액이상 또는 경험자, 출혈경향이 있는 환자, 심장기능이상이 있는 환자, 과민증의 경험자, 기관지 천식 환자, 노인, 만 2세 미만의 소아, 임부 또는 수유부는 의사 또는 약사와 상의하십시오. 통증이나 발열 증상이 지속되거나 악화될 경우, 또는 새로운 증상이 나타날 경우 의사 또는 약사와 상의하십시오.","아세트아미노펜을 포함하는 다른 제품, 바르비탈계 약물, 삼환계 항우울제, 알코올과 함께 복용하지 마십시오. 와파린, 리튬, 티아지드계 이뇨제, 다른 소염진통제와 함께 복용 시 의사 또는 약사와 상의하십시오.",,실온에서 보관하십시오. 어린이의 손이 닿지 않는 곳에 보관하십시오.,
50,K-005025,199500536,셀라펜정,알리코제약(주),"이 약은 신경통, 근육통, 관절통, 요(허리)통, 염좌통(삔 통증), 견통(어깨결림), 근경련(근육경련), 근경직등 근육의 이상 긴장을 수반하는 여러 질환에 사용합니다.","성인은 1회 2정 1일 4회까지 공복을 피하여 복용합니다. 연령, 증상에 따라 적절히 증감합니다.",,"이 약 또는 클로르족사존에 과민증 환자, 과민증상(발진, 충혈되어 붉어짐, 가려움, 후두, 눈꺼풀, 입술의 부기) 경험자 및 다른 감기약, 해열진통제 사용 시 천식 경험자는 이 약을 복용하지 마십시오. 이 약을 복용하기 전에 임부 또는 임신하고 있을 가능성이 있는 여성은 의사 또는 약사와 상의하십시오.","아세트아미노펜을 포함하는 다른 제품과 함께 복용하지 마십시오. 바르비탈계 약물, 삼환계 항우울제 및 알코올을 투여한 환자가 이 약을 함께 복용 시 의사 또는 약사와 상의하십시오.","두드러기, 발적(충혈되어 붉어짐), 가려움증, 알레르기성 피부발진, 점상출혈(출혈점), 반상출혈(피부에 검보랏빛 얼룩점이 생기는 내부출혈), 요변색, 매우 드물게 혈관신경성 부기 또는 아나필락시스 증상, 간기능 이상 등이 나타나는 경우 복용을 즉각 중지하고 의사 또는 약사와 상의하십시오. 때때로 위장장애, 졸음, 어지러움, 두통, 권태, 과도한 흥분, 드물게 위장출혈이 나타날 수 있습니다.",습기와 빛을 피해 실온에서 보관하십시오. 어린이의 손이 닿지 않는 곳에 보관하십시오.,
51,K-005094,199501099,삼남건조수산화알루미늄겔정,삼남제약(주),"이 약은 위.십이지장궤양, 위염, 위산과다의 제산작용 및 증상의 개선에 사용합니다.","성인은 1회 1~2정(300~600 mg), 1일 3회 식간에 복용합니다. 연령, 증상에 따라 적절히 증감합니다.",,"투석요법을 받고 있는 환자는 이 약을 복용하지 마십시오. 이 약을 복용하기 전에 인산염 결핍, 신장애 환자, 신장병 경험자는 의사 또는 약사와 상의하십시오. 장기연용을 하지 마십시오.","테트라사이클린계 항생물질을 함께 복용하지 마십시오. 이 약의 흡착작용 또는 소화관내, 체액의 pH상승에 의해 함께 복용하는 약물의 흡수, 배설에 영향을 줄 수 있습니다.","때때로 변비 드물게 구역, 구토 등이 나타날 수 있습니다.",실온에서 보관하십시오.,
52,K-005223,199501953,신일티아민염산염정,신일제약(주),"이 약은 비타민 B1 결핍증의 예방 및 치료에 사용하며 소모성 질환, 갑상선기능항진증, 임산부, 수유부, 심한 육체노동 시 비타민 B1의 수요가 증대하여 식사로부터의 섭취가 불충분한 경우의 보급, 베르니케뇌병증, 각기, 비타민 B1 결핍 또는 대사장애가 관여한다고 추정되는 근육통, 관절통, 신경통, 말초신경염, 말초신경마비에 사용합니다.","성인은 1회 1～10 mg씩, 1일 1~3회 복용합니다.",,이 약에 과민증 환자는 이 약을 복용하지 마십시오. 정해진 용법과 용량을 잘 지키십시오. 1개월 정도 투여하여도 증상의 개선이 없거나 악화될 경우에는 의사 또는 약사와 상의하십시오.,,"발열, 가려움, 두드러기, 무기력함, 발한, 구역, 청색증, 호흡기부종, 위장관출혈 등이 나타나는 경우 복용을 즉각 중지하고 의사 또는 약사와 상의하십시오.",습기와 빛을 피해 실온에서 보관하십시오. 어린이의 손이 닿지 않는 곳에 보관하십시오.,
53,K-005466,199600246,베스자임정,동아에스티(주),"이 약은 소화불량, 식욕감퇴(식욕부진), 과식, 체함, 소화촉진, 소화불량으로 인한 위부팽만감에 사용합니다.",성인은 1회 1정 1일 3회 식후에 복용합니다.,,"만 7세 이하의 어린이, 갈락토오스 불내성, Lapp 유당분해효소 결핍증 또는 포도당-갈락토오스 흡수장애 등의 유전적인 문제가 있는 환자는 이 약을 복용하지 마십시오. 이 약을 복용하기 전에 알레르기 체질인 환자는 의사 또는 약사와 상의하십시오. 정해진 용법과 용량을 잘 지키십시오. 2주 정도 복용하여도 증상의 개선이 없을 경우 복용을 즉각 중지하고 의사 또는 약사와 상의하십시오.","이 약을 복용하기 전에 다른 약물을 복용하고 있는 경우, 나트륨 제한 식이를 하는 사람은 의사 또는 약사와 상의하십시오.",,습기와 빛을 피해 실온에서 보관하십시오. 어린이의 손이 닿지 않는 곳에 보관하십시오.,
54,K-005556,199600581,바이탈씨에프정,(주)유한양행,"이 약은 육체피로, 임신ㆍ수유기, 병중ㆍ병후(병을 앓는 동안이나 회복 후)의 체력 저하 시, 노년기의 비타민B2, B6, C, E의 보급과 햇볕ㆍ피부병 등에 의한 색소침착(기미, 주근깨)의 완화, 잇몸출혈, 비출혈(코피) 예방에 사용합니다.","만 8세 이상 및 성인은 1회 1정씩, 1일 2회 입안에서 녹이거나 씹어서 복용합니다.",이 약은 체내에서 페닐알라닌으로 대사되는 아스파탐이 함유되어 페닐알라닌의 섭취를 규제할 필요가 있는 페닐케톤뇨증 환자는 복용하지 마십시오.,"이 약에 과민증 환자, 만 3개월 미만의 젖먹이는 이 약을 복용하지 마십시오. 이 약을 복용하기 전에 만 1세 미만의 젖먹이, 고옥살산뇨증(뇨중에 과량의 수산염이 배설되는 상태), 임부 또는 임신하고 있을 가능성이 있는 여성, 수유부, 미숙아, 유아, 통풍 또는 신장(콩팥)결석 환자, 혈전(혈관막힘)성 소인이 있는 환자는 의사 또는 약사와 상의하십시오. 정해진 용법과 용량을 잘 지키십시오. 어린이에게 투여할 경우 보호자의 지도 감독하에 투여하십시오. 각종 요검사 시에 혈당의 검출을 방해할 수 있으며, 요를 황색으로 변하게 하여 임상검사치에 영향을 줄 수 있습니다.",레보도파와 함께 복용하지 마십시오. 에스트로겐을 포함한 경구용 피임제와 함께 복용 시 의사 또는 약사와 상의하십시오.,"구역, 구토, 설사, 식욕부진, 복부(배부분)팽만감, 위부불쾌감, 변비, 발진, 발적(충혈되어 붉어짐), 생리가 예정보다 빨라지거나 양이 점점 많아지거나, 출혈이 오래 지속 되는 증상이 나타나는 경우 복용을 즉각 중지하고 의사 또는 약사와 상의하십시오.",습기와 빛을 피해 실온에서 보관하십시오. 어린이의 손이 닿지 않는 곳에 보관하십시오.,
55,K-005676,199601520,복합파자임이중정,부광약품(주),"이 약은 소화불량, 식욕감퇴(식욕부진), 과식, 체함, 소화촉진, 소화불량으로 인한 위부팽만감에 사용합니다.",성인 및 15세 이상은 1회 1~2정 1일 3회 식후에 복용합니다.,,"만 7세 이하의 어린이, 갈락토오스 불내성, Lapp 유당분해효소 결핍증 또는 포도당-갈락토오스 흡수장애 등의 유전적인 문제가 있는 환자는 이 약을 복용하지 마십시오. 이 약을 복용하기 전에 알레르기 체질인 환자, 임부 또는 임신하고 있을 가능성이 있는 여성은 의사 또는 약사와 상의하십시오. 정해진 용법과 용량을 잘 지키십시오. 2주 정도 복용하여도 증상의 개선이 없을 경우 복용을 즉각 중지하고 의사 또는 약사와 상의하십시오.",이 약을 복용하기 전에 다른 약물을 복용하고 있는 경우 의사 또는 약사와 상의하십시오.,,습기와 빛을 피해 실온에서 보관하십시오. 어린이의 손이 닿지 않는 곳에 보관하십시오.,
56,K-005849,199602668,무스판정,지엘파마(주),"이 약은 위장관계 질환의 발작성 동통 또는 담도계, 비뇨기계, 월경곤란증 등 여성 생식기계의 기능장애 및 경련성 동통에 사용합니다.",성인은 1회 1~2정 1일 3회 복용합니다. 1일 최대용량은 6정을 초과하지 마십시오.,매일 세잔 이상 정기적 음주자가 이 약 또는 다른 해열진통제를 복용할 때는 의사 또는 약사와 상의하십시오. 간손상을 일으킬 수 있습니다.,"이 약에 의한 과민증(발진, 붉은 반점, 가려움, 후두, 눈꺼풀, 입술 등의 부종)의 경험자, 다른 감기약 또는 해열진통제에 의한 천식 경험자, 심한 증상 신장애, 글루코스-6-인산탈수소효소 결핍증 환자, 녹내장, 전립선비대증에 의한 배뇨(소변을 눔)장애, 유문협착(유문 좁아짐) 등 위장관의 기능적 협착, 마비성 또는 폐쇄성 장폐색(창자막힘증) 환자, 심한 증상 근육무력증, 거대결장 환자, 빈맥 및 빠른 부정맥 환자, 심한 증상 간장애, 심한 증상 심질환, 출혈성대장염, 소화성궤양, 심한 혈액이상 환자, 바르비탈계 약물, 삼환계 항우울제, 알코올을 복용한 사람은 이 약을 복용하지 마십시오. 이 약을 복용하기 전에 세균성설사 환자, 간장애 또는 그 경험자, 길버트증후군(모일렌그라하트증), 심장기능이상(관상동맥부전, 심부전, 부정맥 등), 신장애 또는 그 경험자, 소화성궤양의 경험자, 혈액이상 또는 그 경험자, 출혈경향이 있는 환자, 기관지천식, 궤양성 대장염, 갑상선기능항진증, 발열 환자, 전립선비대, 고령자, 임부 또는 임신 가능성이 있는 여성 및 수유부, 협각녹내장 위험성이 있는 환자, 장이나 요관 출구 막힘에 걸리기 쉬운 환자 및 빠른 부정맥이 발생하기 쉬운 환자 의사 또는 약사와 상의하십시오. 눈의 조절장애가 나타날 수 있으므로 운전 및 기계조작 시 주의하십시오.","아세트아미노펜을 포함하는 다른 제품, 바르비탈계 약물, 삼환계 항우울약 및 알코올을 복용한 사람은 이 약을 복용하지 마십시오. 와파린, 리튬, 티아지드계 이뇨제, 사환계 항우울약, 항히스타민제, 항정신병약, 퀴니딘, 아만타딘, 디소피라미드 및 기타 항콜린약물(티오트로피움, 이프라트로피움, 아트로핀 유사 화합물), 메토클로프라미드와 같은 항도파민약, β-효능약, 프로판텔린, 클로람페니콜, 프로베네시드, 지도부딘, 콜레스티라민과 함께 복용 시 의사 또는 약사와 상의하십시오.","혈소판감소증, 무과립구증, 청색증, 백혈구감소증, 과립구감소, 용혈성(적혈구 파괴성)빈혈, 메트헤모글로빈혈증, 혈소판기능저하(출혈시간 연장), 홍조, 피부 반응, 땀분비이상, 가려움증, 피부건조, 두드러기, 붉은 반점, 쇼크를 포함한 혈압저하, 아나필락시스성 쇼크, 약물 발진, 호흡곤란, 과민증, 혈관 부종, 발진, 부종(후두, 눈꺼풀, 입술 등), 가슴답답함, 손발이 차가움, 식은 땀, 숨가쁨, 화상모양물집, 알레르기 반응, 피부점막안증후군(스티븐스-존슨증후군), 독성표피괴사용해증(리엘 증후군), 두근거림, 빠른 맥, 현기증, 피로감, 기관지경련, 목마름증, 설사, 구역, 구토, 식욕부진, 변비, 복부팽만, 아미노기 전환효소 증가, 배뇨(소변을 눔)곤란, 소변이 고임, 동공확대, 모양근마비, 조절장애(고도원시환자), 불안, 흥분, 환각, 두통, 머리 무거움, 이상고열, 예기치 못한 복통이 지속되거나 더 악화될 때, 또는 이러한 증상들이 발열, 구역, 구토, 장운동의 변화, 복부압통(누르는 통증), 혈압 저하, 실신 및 혈변 등이 나타나는 경우 복용을 즉각 중지하고 의사 또는 약사와 상의하십시오.",실온에서 보관하십시오. 어린이의 손이 닿지 않는 곳에 보관하십시오.,
57,K-005886,199603003,타이레놀이알서방정,(주)한국얀센,"이 약은 해열 및 감기에 의한 동통(통증)과 두통, 치통, 근육통, 허리동통(통증), 생리통, 관절통의 완화에 사용합니다.",12세 이상의 소아 및 성인은 매 8시간마다 2정씩 복용합니다. 24시간 동안 6정을 초과하지 마십시오.,"매일 세잔 이상 정기적 음주자가 이 약 또는 다른 해열진통제를 복용할 때는 의사 또는 약사와 상의하십시오. 간손상을 일으킬 수 있습니다. 매우 드물게 치명적일 수 있는 급성전신발진고름물집증, 스티븐스- 존슨증후군, 독성표피괴사용해와 같은 중대한 피부반응이 보고되었고 이 약 복용 후 피부발진 또는 다른 과민반응의 징후가 나타나는 경우 즉시 복용을 중단하십시오. 아세트아미노펜으로 일일 최대 용량(4,000 mg)을 초과하여 복용하지 마십시오. 간손상을 일으킬 수 있습니다. 아세트아미노펜을 포함하는 다른 제품과 함께 복용하지 마십시오.","이 약에 과민증 환자, 소화성궤양, 심한 혈액이상, 심한 간장애, 심한 신장장애, 심한 심장기능저하, 아스피린 또는 다른 소염진통제에 의한 천식 경험 환자, 바르비탈계 약물, 삼환계 항우울제 복용한 환자, 알코올을 복용한 사람, 12세 미만의 소아는 이 약을 복용하지 마십시오. 이 약을 복용하기 전에 간장애, 신장(콩팥)장애, 소화성궤양, 혈액이상, 출혈경향, 심장기능이상, 과민증 경험자, 기관지천식, 노인, 임부 또는 수유부는 의사 또는 약사와 상의하십시오. 의사 또는 약사의 지시없이 통증에 10일 이상(성인) 또는 5일 이상(소아) 복용하지 않고 발열에 3일 이상 복용하지 않습니다. 이 약은 서방형 제제이므로 정제를 으깨거나 씹거나 녹이지 말고 그대로 삼켜서 복용합니다.","다른 소염(항염)진통제, 아세트아미노펜을 포함하는 다른 제품, 바르비탈계 약물, 삼환계 항우울제, 알코올과 함께 이 약을 복용하지 마십시오. 이 약을 복용하기 전에 와파린, 리튬, 티아지드계 이뇨제를 복용한 환자는 의사 또는 약사와 상의하십시오.",,실온에서 보관하십시오. 어린이의 손이 닿지 않는 곳에 보관하십시오.,
58,K-006025,199700120,세트린정,한국휴텍스제약(주),"이 약은 계절성 및 다년성 알레르기성 비염, 알레르기성 결막염, 만성 특발성 두드러기, 피부소양증과 하이드로코티손 외용제와 병용에 의한 습진, 피부염에 사용합니다.","성인 및 6세 이상의 소아는 1일 1회 1정(10 mg)을 취침 전에 복용하고, 이상반응에 민감한 환자의 경우는 1 / 2 정(5 mg)씩을 아침, 저녁에 분할 복용합니다. 연령, 증상에 따라 적절히 증감합니다. 중등도~중증(심한 증상)의 신장애 환자의 투여 간격은 환자의 신기능에 따라 조절되어야 하고, 신장애를 가진 소아 환자는 환자의 신 청소율과 체중을 고려하여 개별적으로 용량을 조절해야 하므로 자세한 사항은 허가사항을 참고하십시오.",,"이 약 및 히드록시진 또는 피페라진 유도체에 과민증 환자, 신부전, 임부 및 임신하고 있을 가능성이 있는 여성 및 수유부, 6세 미만의 유아, 갈락토오스 불내성, Lapp 유당분해효소 결핍증 또는 포도당-갈락토오스 흡수장애 등의 유전적인 문제가 있는 환자는 이 약을 복용하지 마십시오. 이 약을 복용하기 전에 신장애, 간장애, 노인, 간질 환자 및 발작 위험성이 있는 환자, 소변고임의 선행요인(척수 병변, 전립선 비대증 등)이 있는 환자는 의사 또는 약사와 상의하십시오.","이 약을 복용하는 동안 테오필린, 리토나비어, 과량의 알코올과 함께 복용하지 마십시오.","졸음, 두통, 때때로 권태감, 마비감, 무력증, 초조, 감각이상, 드물게 가볍고 일시적인 나른함, 피로, 어지러움, 머리무거움, 흥분, 경련, 운동이상, 근육긴장이상, 실신, 떨림, 공격성, 혼돈, 우울, 환각, 불면증, 틱 장애, 기억상실, 기억장애, 자살관념, 악몽, 때때로 목마름, 입술건조감, 구역, 식욕부진, 위부불쾌감, 소화불량, 복통, 위통, 복부불쾌감, 설사, 드물게 구토, 위장장애, 입술염, 미각이상, 식욕증진, 드물게 빠른맥, 부정맥, 혈압상승, 때때로 두근거림, 혈관염, 때때로 백혈구 감소, 호중구 감소, 림프구 증가, 호산구 증가, 드물게 단구 증가, 혈소판 증가 또는 감소, 광과민증, 드물게 과민증 및 과민성 쇼크, 두드러기, 혈관부기, 고정약물발진, 급성전신발진농포증, 드물게 흐린 시력, 결막충혈, 안조절 장애, 전후축의 안구운동, 현기증, 때때로 BUN 상승, 당뇨, 피섞인 소변, 드물게 배뇨 곤란, 야뇨증, 관절통, 소변고임, 인두염, 기침, 코피, 기관지경련, 청력이상, 시각이상, 때때로 가슴통증, 드물게 월경불순, 귀울림, 비염, 체중 증가가 나타나는 경우 복용을 즉각 중지하고 의사 또는 약사와 상의하십시오. 이 약 복용 중단 후 가려움증, 두드러기등이 나타날 수 있습니다.",실온에서 보관하십시오. 어린이의 손이 닿지 않는 곳에 보관하십시오.,
59,K-006064,199700265,알레리진정,이연제약(주),"이 약은 계절성 및 다년성 알레르기성 비염, 알레르기성 결막염, 만성 특발성 두드러기, 피부가려움증과 하이드로코티손 외용제와 병용에 의한 습진, 피부염에 사용합니다.","성인 및 6세 이상의 소아는 1일 1회 1정(10 mg)을 취침 전에 복용하고, 이상반응에 민감한 환자의 경우는 1 / 2 정(5 mg)씩을 아침, 저녁에 분할 복용합니다. 연령, 증상에 따라 적절히 증감합니다. 신장애 환자의 투여 간격은 환자의 신기능에 따라 조절되어야 하고, 신장애를 가진 소아 환자는 환자의 신 청소율과 체중을 고려하여 개별적으로 용량을 조절해야 하므로 자세한 사항은 허가사항을 참고하십시오.",,"이 약 및 히드록시진 또는 피페라진 유도체에 과민증 환자, 신부전 환자(크레아티닌 청소율 < 10mL/min), 임부 또는 임신하고 있을 가능성이 있는 여성 및 수유부, 6세 미만의 유아, 갈락토오스 불내성, Lapp 유당분해효소 결핍증 또는 포도당-갈락토오스 흡수장애 등의 유전적인 문제가 있는 환자는 이 약을 복용하지 마십시오. 이 약을 복용하기 전에 신장애, 간장애 환자, 노인, 뇌전증 환자 및 발작 위험성이 있는 환자, 소변고임의 선행요인(척수 병변, 전립선 비대증)이 있는 환자는 의사 또는 약사와 상의하십시오.","테오필린, 리토나비어와 함께 복용하지 마십시오. 과량의 알코올과 함께 복용하지 마십시오.","이 약 투여 중단 후 가려움증, 두드러기가 나타날 수 있습니다.",실온에서 보관하십시오. 어린이의 손이 닿지 않는 곳에 보관하십시오.,
