108,K-010944,200102653,스카이정,(주)한국파비스제약,"이 약은 위장관계 질환의 발작성 동통 또는 담도계, 비뇨기계, 월경곤란증 등 여성 생식기계의 기능장애 및 경련성 동통에 사용합니다.",성인은 1회 1~2정 1일 3회 복용합니다. 1일 최대용량은 6정을 초과하지 마십시오.,매일 세잔 이상 정기적 음주자가 이 약 또는 다른 해열진통제를 복용할 때는 의사 또는 약사와 상의하십시오. 간손상을 일으킬 수 있습니다.,"이 약에 의한 과민증(발진, 붉은 반점, 가려움, 후두, 눈꺼풀, 입술 등의 부종)의 경험자, 다른 감기약 또는 해열진통제에 의한 천식 경험자, 심한 증상 신장애, 글루코스-6-인산탈수소효소 결핍증 환자, 녹내장, 전립선비대증에 의한 배뇨(소변을 눔)장애, 유문협착(유문 좁아짐) 등 위장관의 기능적 협착, 마비성 또는 폐쇄성 장폐색(창자막힘증) 환자, 심한 증상 근육무력증, 거대결장 환자, 빈맥 및 빠른 부정맥 환자, 심한 증상 간장애, 심한 증상 심질환, 출혈성대장염, 소화성궤양, 심한 혈액이상 환자, 바르비탈계 약물, 삼환계 항우울제, 알코올을 복용한 사람은 이 약을 복용하지 마십시오. 이 약을 복용하기 전에 세균성설사 환자, 간장애 또는 그 경험자, 길버트증후군(모일렌그라하트증), 심장기능이상(관상동맥부전, 심부전, 부정맥 등), 신장애 또는 그 경험자, 소화성궤양의 경험자, 혈액이상 또는 그 경험자, 출혈경향이 있는 환자, 기관지천식, 궤양성 대장염, 갑상선기능항진증, 발열 환자, 전립선비대, 고령자, 임부 또는 임신 가능성이 있는 여성 및 수유부, 협각녹내장 위험성이 있는 환자, 장이나 요관 출구 막힘에 걸리기 쉬운 환자 및 빠른 부정맥이 발생하기 쉬운 환자 의사 또는 약사와 상의하십시오. 눈의 조절장애가 나타날 수 있으므로 운전 및 기계조작 시 주의하십시오.","아세트아미노펜을 포함하는 다른 제품, 바르비탈계 약물, 삼환계 항우울약 및 알코올을 복용한 사람은 이 약을 복용하지 마십시오. 와파린, 리튬, 티아지드계 이뇨제, 사환계 항우울약, 항히스타민제, 항정신병약, 퀴니딘, 아만타딘, 디소피라미드 및 기타 항콜린약물(티오트로피움, 이프라트로피움, 아트로핀 유사 화합물), 메토클로프라미드와 같은 항도파민약, β-효능약, 프로판텔린, 클로람페니콜, 프로베네시드, 지도부딘, 콜레스티라민과 함께 복용 시 의사 또는 약사와 상의하십시오.","혈소판감소증, 무과립구증, 청색증, 백혈구감소증, 과립구감소, 용혈성(적혈구 파괴성)빈혈, 메트헤모글로빈혈증, 혈소판기능저하(출혈시간 연장), 홍조, 피부 반응, 땀분비이상, 가려움증, 피부건조, 두드러기, 붉은 반점, 쇼크를 포함한 혈압저하, 아나필락시스성 쇼크, 약물 발진, 호흡곤란, 과민증, 혈관 부종, 발진, 부종(후두, 눈꺼풀, 입술 등), 가슴답답함, 손발이 차가움, 식은 땀, 숨가쁨, 화상모양물집, 알레르기 반응, 피부점막안증후군(스티븐스-존슨증후군), 독성표피괴사용해증(리엘 증후군), 두근거림, 빠른 맥, 현기증, 피로감, 기관지경련, 목마름증, 설사, 구역, 구토, 식욕부진, 변비, 복부팽만, 아미노기 전환효소 증가, 배뇨(소변을 눔)곤란, 소변이 고임, 동공확대, 모양근마비, 조절장애(고도원시환자), 불안, 흥분, 환각, 두통, 머리 무거움, 이상고열, 예기치 못한 복통이 지속되거나 더 악화될 때, 또는 이러한 증상들이 발열, 구역, 구토, 장운동의 변화, 복부압통(누르는 통증), 혈압 저하, 실신 및 혈변 등이 나타나는 경우 복용을 즉각 중지하고 의사 또는 약사와 상의하십시오.",실온에서 보관하십시오. 어린이의 손이 닿지 않는 곳에 보관하십시오.,
109,K-010955,200102671,미다펜정,(주)한국파비스제약,"이 약은 신경통, 근육통, 관절통, 요(허리)통, 염좌통(삔 통증), 견통(어깨결림), 근경련(근육경련), 근경직등 근육의 이상 긴장을 수반하는 제질환(여러 질환)에 사용합니다.","성인은 1회 2정, 1일 4회까지 공복을 피하여 복용합니다. 연령, 증상에 따라 적절히 증감합니다.",,"이 약에 과민증 환자, 클로르족사존에 과민증, 아세트아미노펜에 과민증, 과민증상(발진, 충혈되어 붉어짐, 가려움, 후두, 눈꺼풀, 입술의 부기) 경험자 및 다른 감기약, 해열진통제 사용 시 천식 경험자는 이 약을 복용하지 마십시오. 이 약을 복용하기 전에 임부 또는 임신하고 있을 가능성이 있는 여성은 의사 또는 약사와 상의하십시오.","아세트아미노펜을 포함하는 다른 제품과 함께 복용하지 마십시오. 바르비탈계 약물, 삼환계 항우울제 및 알코올을 투여한 환자가 이 약을 함께 복용 시 의사 또는 약사와 상의하십시오.","두드러기, 부종(후두, 눈꺼풀, 입술, 등), 가슴답답함 등과 함께 안색이 창백해지고, 수족이 차가워지고, 식은땀, 숨가뿜, 고열을 수반하며 발진, 발적, 화상모양 수포 등의 격렬한 증상이 전신피부, 입 및 눈의 점막에 나타난 경우, 천식, 간기능 이상, 드물게 알레르기성 피부발진, 점상출혈, 반상출혈, 요변색, 매우 드물게 혈관신경성 부종 또는 아나필락시스 증상이 나타나는 경우 복용을 즉각 중지하고 의사 또는 약사와 상의하십시오. 때때로 위장장애, 졸음, 어지러움, 두통, 권태, 과도한 흥분, 드물게 위장출혈이 나타날 수 있습니다.",습기와 빛을 피해 실온에서 보관하십시오. 어린이의 손이 닿지 않는 곳에 보관하십시오.,
110,K-010995,200102905,구주로라타딘정,구주제약(주),"이 약은 알레르기성 비염(재채기, 코막힘, 가려움, 눈의 작열감), 만성 특발성(원인 불명의) 두드러기에 사용합니다.","성인 및 12세 이상의 소아는 1일 1회 1정(10 mg) 복용합니다. 6~12세 미만의 소아는 체중이 30 kg이상인 경우 1일 1회 1정(10 mg), 30 kg이하인 경우 1일 1회 1 / 2 정(5 mg) 복용합니다. 연령, 증상에 따라 적절히 증감합니다.",,"이 약에 과민증 환자, 만 6세 미만의 소아, 임부 및 수유부,갈락토오스 불내성, Lapp 유당분해효소 결핍증 또는 포도당-갈락토오스 흡수장애 등의 유전적인 문제가 있는 환자는 이 약을 복용하지 마십시오. 이 약을 복용하기 전에 간장애, 신부전 환자는 의사 또는 약사와 상의하십시오.","이 약을 복용하는 동안 시메티딘, 에리트로마이신, 케토코나졸, 퀴니딘, 플루코나졸, 플루옥세틴, 간 대사를 억제하는 약물을 함께 복용하지 마십시오.","진정작용, 항콜린작용, 두통, 실신, 졸음, 목마름, 위장장애(구역, 위염), 식욕증진, 빈맥, 피로, 발진, 탈모증, 혈관부종을 포함한 아나필락시스, 간기능 장애, 상실성 부정빈맥, 두근거림, 어지러움, 경련 등이 나타나는 경우 복용을 즉각 중지하고 의사 또는 약사와 상의하십시오.",실온에서 보관하십시오. 어린이의 손이 닿지 않는 곳에 보관하십시오.,
111,K-011015,200103013,시노카엔캡슐,현대약품(주),"이 약은 코감기(급성비염, 알레르기성 비염(코염) 또는 부비동염에 의한 코막힘, 콧물, 재채기, 눈물, 인후통(목구멍 통증), 머리무거움의 완화에 사용합니다.",성인은 4시간 이상의 간격으로 1회 1캡슐씩 1일 3회 식후 복용합니다.,,"이 약을 복용하기 전에 만 2세 미만의 영아 및 유아, 고령자, 알레르기 체질, 고혈압, 심장질환, 녹내장(눈의 통증, 눈이 침침함), 배뇨곤란, 갑상선질환, 당뇨병, 몸이 약한 사람, 고열, 흡연, 천식, 만성 기관지염, 폐기종, 과도한 가래가 동반되는 기침, 1주 이상 지속 또는 재발되는 기침, 만성 기침, 발열, 발진이나 지속적인 두통이 동반되는 기침 환자는 의사 또는 약사와 상의하십시오. 정해진 용법과 용량을 잘 지키십시오. 복용 후 졸음이 나타날 수 있으므로 운전 및 기계조작 시 주의하십시오.",복용 중에는 음주하지 마십시오.,"출혈성뇌졸중, 구역, 구토, 지속적이거나 심한 목마름, 변비, 식욕부진, 발진, 발적, 가려움, 배뇨곤란, 두통, 안면홍조, 비정상적인 눈부심 등이 나타나는 경우 복용을 즉각 중지하고 의사 또는 약사와 상의하십시오.",습기와 빛을 피해 실온에서 보관하십시오. 어린이의 손이 닿지 않는 곳에 보관하십시오.,
112,K-011029,200103049,하이스탈정,명문제약(주),"이 약은 위산과다, 속쓰림, 위부불쾌감, 위부팽만감, 식체(위체), 구역, 구토, 위통, 신트림, 소화불량, 식욕감퇴(식욕부진), 과식, 소화촉진, 소화불량으로 인한 위부팽만감에 사용합니다.",성인은 1회 2정 1일 3회 매 식후에 복용합니다.,,"투석요법을 받고 있는 환자, 갈락토오스 불내성, Lapp 유당분해효소 결핍증 또는 포도당-갈락토오스 흡수장애 등의 유전적인 문제가 있는 환자, 소아(15세 미만), 임부 또는 임신하고 있을 가능성이 있는 여성 및 수유부는 이 약을 복용하지 마십시오. 이 약을 복용하기 전에 이 약에 알레르기 증상(발진, 발적(충혈되어 붉어짐), 가려움 등), 신장장애, 간장애, 인산염 저하가 있는 환자, 황색4호에 과민증 환자 또는 경험자, 혈압이 높은 환자, 고령자, 심장장애, 부종 환자는 의사 또는 약사와 상의하십시오. 정해진 용법과 용량을 잘 지키십시오.","위장진통, 진경제와 함께 복용하지 마십시오. 칼륨함유제제, 감초함유제제, 글리시리진산 혹은 그 염류 함유제제, 루프계 이뇨제(푸로세미드, 에타크린산) 또는 티아지드계 이뇨제(트리클로르메치아지드)와 함께 복용 시 의사 또는 약사와 상의하십시오.","알레르기 증상(발진, 가려움 등), 동계, 졸음, 현훈(어지러움), 권태감, 두통, 변비, 또는 입이 마르는 증상, 뇨량이 감소하거나, 얼굴이나 손발이 붓거나, 눈꺼풀이 무겁거나, 손이 굳어지거나, 혈압이 오르거나, 근병증(무력감, 사지경련, 마비 등) 등이 나타나는 경우 복용을 즉각 중지하고 의사 또는 약사와 상의하십시오. 드물게 심계항진, GOT, GPT 상승이 나타날 수 있습니다.",습기와 빛을 피해 실온에서 보관하십시오. 어린이의 손이 닿지 않는 곳에 보관하십시오.,
113,K-011064,200103343,팬스타정,(주)서울제약,"이 약은 만성 다발성관절염, 류마티스관절염, 관절증, 강직척추염, 외상 및 수술 후 통증성 부종 또는 염증 그리고 염증, 통증 및 발열을 수반하는 감염증의 치료보조에 사용합니다.","성인은 1회 1정(300 mg)씩, 1일 2~4회 복용합니다. 단, 1일 4정(1,200 mg)을 초과하지 않습니다.","매일 세잔 이상 정기적 음주자가 이 약 또는 다른 해열진통제를 복용할 때는 의사 또는 약사와 상의하십시오. 위장출혈을 일으킬 수 있습니다. 이 약 복용 시 치명적일 수 있는 중대한 심혈관계 혈전 반응, 심근경색증, 뇌졸중의 위험이 증가하며 심각한 심혈관계 이상반응이 나타날 수 있습니다. 이 약 복용 시 위장관의 출혈, 궤양 및 천공(뚫림) 등 치명적일 수 있는 중대한 위장관계 이상반응이 나타날 수 있습니다.",약물투여의 중요성을 고려하여 수유를 중단하거나 약물투여를 중단하십시오. 이 약 복용 후 어지러움 또는 피로가 나타날 수 있으므로 운전 및 기계조작 시 주의하십시오. 급성질환에 장기 복용할 경우 원칙적으로 5일 이내로 합니다.,"아스피린, 다른 비스테로이드성 소염진통제, 고용량의 메토트렉세이트와 함께 복용하지 마십시오.",,습기와 빛을 피해 실온에서 보관하십시오. 어린이의 손이 닿지 않는 곳에 보관하십시오.,
114,K-011154,200103882,프리메정,한국프라임제약(주),"이 약은 만성 다발성 관절염, 류마티스관절염, 관절증, 강직척추염, 외상 및 수술 후 통증성 부종 또는 염증, 염증, 통증 및 발열을 수반하는 감염증의 치료보조에 사용합니다.","성인은 1회 1정(300 mg)씩, 1일 2~4회 복용합니다. 단, 1일 4정(1,200 mg)을 초과하지 않습니다.","매일 세잔 이상 정기적 음주자가 이 약 또는 다른 해열진통제를 복용할 때는 의사 또는 약사와 상의하십시오. 위장출혈을 일으킬 수 있습니다. 이 약 복용 시 치명적일 수 있는 중대한 심혈관계 혈전 반응, 심근경색증, 뇌졸중의 위험이 증가하며 심각한 심혈관계 이상반응이 나타날 수 있습니다. 이 약 복용 시 위장관의 출혈, 궤양 및 천공(뚫림) 등 치명적일 수 있는 중대한 위장관계 이상반응이 나타날 수 있습니다.",약물투여의 중요성을 고려하여 수유를 중단하거나 약물투여를 중단하십시오. 이 약 복용 후 어지러움 또는 피로가 나타날 수 있으므로 운전 및 기계조작 시 주의하십시오. 급성질환에 장기 복용할 경우 원칙적으로 5일 이내로 합니다.,"아스피린, 다른 비스테로이드성 소염진통제, 고용량의 메토트렉세이트와 함께 복용하지 마십시오.",,습기와 빛을 피해 실온에서 보관하십시오. 어린이의 손이 닿지 않는 곳에 보관하십시오.,
115,K-011166,200103964,시노피드플러스정,대화제약(주),"이 약은 감기의 여러 증상(콧물, 코막힘, 재채기, 인후통, 오한, 발열, 두통, 관절통, 근육통)의 완화에 사용합니다.",성인은 1회 1~2정씩 4∼6시간마다 복용합니다. 1일 최대 8정을 초과하여 복용하지 마십시오.,,"이 약을 복용하기 전에 수두 또는 인플루엔자에 감염되어 있거나 또는 의심되는 영아 및 만 15세 미만의 어린이, 만 3개월 이상 및 만 1세 미만의 영아, 유아, 알레르기 등을 일으키기 쉬운 체질, 알레르기 증상(예: 발열, 발진, 관절통, 천식, 가려움증 등)경험자, 간장질환, 신장(콩팥)질환, 심장질환, 갑상선질환, 당뇨병, 고혈압, 위십이지장궤양, 녹내장(예: 눈의 통증, 눈이 침침함 등), 배뇨(소변을 눔)곤란 등이 있는 사람, 고령자, 몸이 약한 사람 또는 고열이 있는 사람, 속쓰림, 위부불쾌감, 위통과 같은 위장문제가 지속 혹은 재발되거나 궤양, 출혈문제를 가지고 있는 사람, 임부 또는 임신하고 있을 가능성이 있는 여성, 수유부, 흡연, 천식, 만성 기관지염, 폐기종, 과도한 가래가 동반되는 기침, 1주 이상 지속 또는 재발되는 기침, 만성 기침, 발열ㆍ발진이나 지속적인 두통이 동반되는 기침이 있는 사람은 의사 또는 약사와 상의하십시오. 복용 후 졸음이 나타날 수 있으므로 운전 및 기계조작 시 주의하십시오.","바르비탈계 약물, 삼환계 항우울제 및 알코올을 투여한 환자, 와파린, 리튬, 티아지드계이뇨제와 함께 복용 시 의사 또는 약사와 상의하십시오. 복용 중에는 음주하지 마십시오.",,습기와 빛을 피해 실온에서 보관하십시오. 어린이의 손이 닿지 않는 곳에 보관하십시오.,
116,K-011354,200109769,애드빌정,(주)글락소스미스클라인컨슈머헬스케어코리아,"이 약은 감기로 인한 발열 및 동통, 요통, 생리통, 류마티양 관절염, 연소성 류마티양 관절염, 골관절염(퇴행성 관절질환), 수술후 동통과 두통, 치통, 근육통, 신경통, 강직성 척추염, 급성통풍, 건선성 관절염, 연조직손상(염좌, 좌상), 비관절 류마티스질환(건염, 건초염, 활액낭염)에 사용합니다.","성인은 류마티양 관절염, 골관절염, 강직성 척추염, 연조직손상, 비관절 류마티스질환, 급성통풍, 건선성 관절염에는 1회 1~3정(200~600 mg) 1일 3~4회 1일 최고 16정(3,200 mg)까지 투여할 수 있으며, 연소성 류마티양 관절염에는 1일 체중 kg당 30~40 mg을 3~4회 분할 경구 투여, 경증 및 중등도의 동통이나 감기에는 성인 1회 1~2정(200~400 mg) 1일 3~4회 복용합니다. 11~14세는 1회 200~250 mg, 7~10세는 1회 150~200 mg, 3~ 6세는 1회 100~150 mg, 1~ 2세는 1회 50~100 mg을 1일 3~4회 복용합니다. 체중이 30kg미만인 어린이는 1일량이 500 mg을 초과해서는 안되며 공복시 투여는 피하는 것이 바람직합니다.",,"이 약에 과민증 환자, 위장관 궤양, 위장관 출혈환자 또는 경험자, 심한 혈액이상, 심한 간장애, 심한 신장장애, 심한 심장기능부전, 심한 고혈압, 기관지천식 또는 경험자, 아스피린이나 다른 비스테로이드성 소염진통제(COX-2 저해제 포함)에 대하여 천식, 두드러기, 알레르기 반응과 같은 과민증 또는 경험자, 관상동맥(심장동맥) 우회로술 전후 통증 환자, 임신 말기 3개월 기간에 해당하는 임부 또는 수유부, 항암요법으로 고용량 메토트렉세이트를 투여중인 환자, 갈락토오스 불내성, Lapp 유당분해효소 결핍증 또는 포도당-갈락토오스 흡수장애 등의 유전적인 문제가 있는 환자는 이 약을 복용하지 마십시오. 이 약을 복용하기 전에 혈액이상 또는 경험자, 출혈경향이 있는 환자, 간경화, 간장애 또는 경험자, 신장장애 또는 경험자, 심장기능부전 또는 심질환, 고혈압, 전신성홍반성루푸스 및 혼합결합조직질환 환자, 궤양성대장염, 크론병, 고령자 및 소아, 임부는 의사 또는 약사와 상의하십시오.",,,실온에서 보관하십시오. 어린이의 손이 닿지 않는 곳에 보관하십시오.,
117,K-011543,200200406,이바내정,정우신약(주),"이 약은 육체피로, 임신·수유기, 병중·병후(병을 앓는 동안이나 회복 후)의 체력 저하 시 비타민 B2, B6, C의 보급과 구각염(입꼬리염), 구순염(입술염), 구내염(입안염), 설염(혀염), 습진, 피부염 증상의 완화에 사용합니다","만 8세 이상 어린이 및 성인은 1회 2정씩, 1일 1회 복용합니다.",,"이 약 또는 대두유, 콩, 땅콩에 과민증 환자, 만 3개월 미만의 젖먹이, 갈락토오스 불내성, Lapp 유당분해효소 결핍증 또는 포도당-갈락토오스 흡수장애 등의 유전적인 문제가 있는 환자는 이 약을 복용하지 마십시오. 이 약을 복용하기 전에 임부 및 임신하고 있을 가능성이 있는 여성, 수유부, 미숙아, 유아, 고옥살산뇨증(뇨중에 과량의 수산염이 배설되는 상태), 통풍 또는 신장결석 환자, 고지단백혈증, 당뇨병성고지질혈증 및 췌장염 등 지방대사 이상 환자 또는 지질성 유제를 신중히 투여해야 하는 환자, 지방 과부하로 특별한 위험이 예상되는 환자는 의사 또는 약사와 상의하십시오. 정해진 용법과 용량을 잘 지키십시오. 어린이에게 투여할 경우 보호자의 지도 감독하에 투여하십시오. 각종 요검사 시에 혈당의 검출을 방해할 수 있으며, 요를 황색으로 변하게 하여 임상검사치에 영향을 줄 수 있습니다. 1개월 정도 복용하여도 증상의 개선이 없을 경우 복용을 즉각 중지하고 의사 또는 약사와 상의하십시오.",레보도파와 함께 복용하지 마십시오.,"구역, 구토, 설사, 식욕부진, 복부팽만감 등이 나타나는 경우 복용을 즉각 중지하고 의사 또는 약사와 상의하십시오.",습기와 빛을 피해 실온에서 보관하십시오. 어린이의 손이 닿지 않는 곳에 보관하십시오.,
118,K-011544,200200414,생장환에스정,정우신약(주),"이 약은 변비와 변비에 수반하는 머리가 무거움, 역상, 피부거침, 부스럼, 식욕부진(식욕감퇴), 복부(배부분)팽만, 장내이상발효, 치질의 완화에 사용합니다.","15세 이상 및 성인은 1회 1~3정을 1일 1회 취침전(또는 공복(빈 속)시)에 복용합니다. 단, 처음은 최소량을 이용하고, 변통의 비율이나 상태를 보면서 조금씩 증량 또는 감량(줄임)하십시오.",,"대두유, 콩 또는 땅콩에 과민증 환자, 갈락토오스 불내성, Lapp 유당분해효소 결핍증 또는 포도당-갈락토오스 흡수장애 등의 유전적인 문제가 있는 환자는 이 약을 복용하지 마십시오. 이 약을 복용하기 전에 심한 복통(배 아픔) 또는 구역, 구토, 고지단백혈증, 당뇨병성고지질혈증, 췌장(이자)염 등 지방대사 이상 또는 지질성 유제를 신중히 투여해야 하는 환자, 은 의사 또는 약사와 상의하십시오. 정해진 용법과 용량을 잘 지키십시오. 1주 정도 복용하여도 변비의 개선이 없을 경우 복용을 중지하고 의사 또는 약사와 상의하십시오.",다른 설사약과 함께 복용하지 마십시오.,"발진·발적(충혈되어 붉어짐), 가려움, 심한 복통(배아픔), 설사, 구토 등이 나타나는 경우 복용을 즉각 중지하고 의사 또는 약사와 상의하십시오.",습기와 빛을 피해 실온에서 보관하십시오. 어린이의 손이 닿지 않는 곳에 보관하십시오.,
119,K-011613,200200662,세토펜이알서방정,삼아제약(주),"이 약은 해열 및 감기에 의한 동통(통증)과 두통, 치통, 근육통, 허리동통(통증), 생리통, 관절통의 완화에 사용합니다.",12세 이상의 소아 및 성인은 매 8시간마다 2정씩 복용합니다. 24시간 동안 6정을 초과하지 마십시오.,"매일 세잔 이상 정기적 음주자가 이 약 또는 다른 해열진통제를 복용할 때는 의사 또는 약사와 상의하십시오. 간손상을 일으킬 수 있습니다. 매우 드물게 치명적일 수 있는 급성전신발진고름물집증, 스티븐스- 존슨증후군, 독성표피괴사용해와 같은 중대한 피부반응이 보고되었고 이 약 복용 후 피부발진 또는 다른 과민반응의 징후가 나타나는 경우 즉시 복용을 중단하십시오. 아세트아미노펜으로 일일 최대 용량(4,000 mg)을 초과하여 복용하지 마십시오. 간손상을 일으킬 수 있습니다. 아세트아미노펜을 포함하는 다른 제품과 함께 복용하지 마십시오.","이 약에 과민증 환자, 소화성궤양, 심한 혈액이상, 심한 간장애, 심한 신장장애, 심한 심장기능저하, 아스피린 또는 다른 소염진통제에 의한 천식 경험 환자, 바르비탈계 약물, 삼환계 항우울제 복용한 환자, 알코올을 복용한 사람, 12세 미만의 소아는 이 약을 복용하지 마십시오. 이 약을 복용하기 전에 간장애, 신장(콩팥)장애, 소화성궤양, 혈액이상, 출혈경향, 심장기능이상, 과민증 경험자, 기관지천식, 노인, 임부 또는 수유부는 의사 또는 약사와 상의하십시오. 의사 또는 약사의 지시없이 통증에 10일 이상(성인) 또는 5일 이상(소아) 복용하지 않고 발열에 3일 이상 복용하지 않습니다. 이 약은 서방형 제제이므로 정제를 으깨거나 씹거나 녹이지 말고 그대로 삼켜서 복용합니다.","다른 소염(항염)진통제, 아세트아미노펜을 포함하는 다른 제품, 바르비탈계 약물, 삼환계 항우울제, 알코올과 함께 이 약을 복용하지 마십시오. 이 약을 복용하기 전에 와파린, 리튬, 티아지드계 이뇨제를 복용한 환자는 의사 또는 약사와 상의하십시오.",,실온에서 보관하십시오. 어린이의 손이 닿지 않는 곳에 보관하십시오.,
