82,K-007843,199901047,태극나렉신정,태극제약(주),"이 약은 류마티양 관절염, 골관절염(퇴행성 관절질환), 강직성 척추염, 건염(힘줄염), 급성통풍, 월경곤란증과 활액(윤활)낭염, 골격근장애(염좌(삠), 좌상(타박상), 외상(상처), 요천통(허리통증)), 수술후 동통(통증), 편두통, 발치(이를 뽑음)후 통증에 사용합니다.","류마티양 관절염, 골관절염, 강직성 척추염에 성인은 1회 1~2정(275~550 mg), 1일 2회(12시간마다), 급성통풍에는 초회량(처음 복용량)으로 3정(825 mg) 복용하고 발작이 없어질때까지 8시간 간격으로 1정(275 mg)을 복용, 골격근장애, 수술후 동통(통증), 발치(이를 뽑음)후 동통(통증), 월경곤란증, 건염(힘줄염), 활액(윤활)낭염에는 초회량(처음 복용량)으로 2정(550 mg)을 복용한 후 6~8시간간격으로 1정(275 mg)씩 복용하고 1일 총용량이 5정(1,375 mg)을 초과하지 않도록 합니다. 편두통에는 초회량(처음 복용량)으로 3정(825 mg)을 복용하고 필요하면 1일 1~2정(275~550 mg)을 더 복용할 수 있으며 초회량(처음 복용량)의 복용 30분 후에 복용합니다. 1일 총용량이 5정(1,375 mg)을 초과하지 않도록 합니다.",,"이 약에 과민증 환자, 소화성궤양, 심한 혈액이상, 심한 간장애, 심한 심기능부전, 심한 신장애, 심한 고혈압, 아스피린 등 비스테로이드성 소염진통제에 과민증 환자, 아스피린이나 다른 비스테로이드성 소염진통제(COX-2 저해제 포함)에 의하여 천식, 비염(코염), 코의 용종, 두드러기, 알레르기 반응 또는 경험자, 관상동맥(심장동맥) 우회로술 전후에 발생하는 통증의 치료 및 갈락토오스 불내성, Lapp 유당분해효소 결핍증 또는 포도당-갈락토오스 흡수장애 등의 유전적인 문제가 있는 환자는 이 약을 복용하지 마십시오. 이 약을 복용하기 전에 소화성궤양 경험자, 혈액이상 경험자, 출혈경향이 있는 환자, 간장애 또는 경험자, 신장애 또는 경험자, 심기능장애, 고혈압, 기관지천식, 전신성홍반성루푸스 및 혼합결합조직질환 환자, 고령자는 의사 또는 약사와 상의하십시오.","다른 비스테로이드성 소염진통제 및 나프록센 유도체, 아스피린, 고용량의 메토트렉세이트와 함께 복용하지 마십시오.","심근경색증 및 뇌졸중의 위험 증가, 위장관의 출혈, 궤양 및 천공(뚫림) 등 치명적일 수 있는 중대한 위장관계 이상반응, 드물게 쇽 증상(호흡곤란, 혈압강하, 서맥(느린 맥), 식은땀, 부기), PIE증후군(호산구증가를 수반하는 폐침윤 : 발열, 숨을 쌕쌕거림, 기침, 가래를 동반함), 두드러기, 때때로 발진, 가려움 등의 과민증상, 토혈(혈액구토), 위장출혈, 소화성궤양, 천공, 무균성 수막염(심한 두통, 구역, 구토, 불면, 목이 뻣뻣함, 발열 또는 의식장애), 습진, 땀이 남, 자반(자주색 반점), 광과민증, 탈모, 발적(충혈되어 붉어짐), 괴사성용해, 다형성홍반(여러 모양의 붉은 반점), 스티븐스-존슨증후군(피부점막안증후군), 두드러기, 표피 수포증, 드물게 무과립구증, 호산구증가, 백혈구감소, 혈소판감소, 재생불량성빈혈, 용혈성(적혈구파괴성)빈혈, 혈소판기능저하(출혈시간의 연장) 등의 혈액장애 등이 나타나는 경우 복용을 즉각 중지하고 의사 또는 약사와 상의하십시오. 때때로 위부불쾌감, 위통, 복통, 구역, 구토, 식욕부진, 소화불량, 가슴쓰림, 설사, 변비, 구내염(입안염), 드물게 복부팽만감, 흑변, 구갈, GOT, GPT 수치의 상승, 황달, 간염, 신장애, 신장염, 혈뇨, 고칼륨혈증, 간질성신염, 신증후군, 신장(콩팥) 유두괴사, 단백뇨(단백질이 섞인 오줌), 신부전, 귀울림, 청각장애, 시각장애, 부기, 호흡곤란, 심계항진(두근거림), 근무력증(근육무력증), 울혈성심부전, 호산구성 폐렴, 아나필락시양 반응, 월경장애, 오한(춥고 떨리는 증상)과 발열, 혈관염, 고혈당, 저혈당 등이 나타날 수 있습니다.",실온에서 보관하십시오. 어린이의 손이 닿지 않는 곳에 보관하십시오.,
83,K-007914,199901458,마그오캡슐,(주)한국파마,"이 약은 위.십이지장궤양, 위염, 위산과다의 제산작용 및 증상의 개선, 변비증에 사용합니다.","위.십이지장궤양, 위염, 위산과다에는 산화마그네슘으로서 1일 1~2캡슐(0.5~1 g)을 수회(여러 차례) 분할 복용, 변비증에는 1일 4캡슐(2 g)을 1~2회 분할 복용합니다. 다만, 초회는 최소량을 복용하고 변의 모양과 상태를 보면서 조금씩 증량 또는 감량합니다.",,"신장장애, 설사 환자는 이 약을 복용하지 마십시오. 이 약을 복용하기 전에 심기능 장애, 고마그네슘혈증 환자, 고령자(만 65세 이상)는 의사 또는 약사와 상의하십시오. 이 약의 흡착작용 또는 소화관내 체액의 pH 상승에 의해 병용 약물의 흡수, 배설에 영향을 줄 수 있으므로 신중히 투여합니다.","이 약을 복용하는 동안 테트라사이클린계 항생물질을 복용하지 마십시오. 다량의 우유, 칼슘제제와 함께 복용 시 의사 또는 약사와 상의하십시오.","일어섰을 때 느끼는 현기증, 맥이 느려짐, 강한 졸음, 의식이 희미해짐, 숨막힘, 근력저하, 구강건조, 구토가 나타나는 경우 복용을 즉각 중지하고 의사 또는 약사와 상의하십시오. 마그네슘 중독증상, 때때로 설사 등이 나타날 수 있습니다.",습기를 피해 실온에서 보관하십시오. 공기 중에서 습기 또는 CO2를 흡수하므로 보관에 주의합니다.,
84,K-007923,199901507,콘로인캡슐,삼진제약(주),이 약은 경증(가벼운 증상)에서 중등도의 골관절염(퇴행성관절염)에 사용합니다.,성인은 1회 1~2캡슐(400~800 mg)을 1일 2회 복용합니다.,,"이 약에 과민증 환자, 급성 관절통 환자, 16세 미만, 갈락토오스 불내성, Lapp 유당분해효소 결핍증 또는 포도당-갈락토오스 흡수장애 등의 유전적인 문제가 있는 환자는 이 약을 복용하지 마십시오. 이 약을 복용하기 전에 임부 또는 임신하고 있을 가능성이 있는 여성 및 수유부, 황색5호에 과민증 환자 또는 경험자는 의사 또는 약사와 상의하십시오.",,"구역·구토, 변비, 설사, 식욕부진, 홍반(붉은 반점), 두드러기, 습진, 발진, 반구진성 발진, 가려움, 부종(부기), 수분 저류(수분 쌓임) 등이 나타나는 경우 복용을 즉각 중지하고 의사 또는 약사와 상의하십시오.",빛을 피해 실온에서 보관하십시오. 어린이의 손이 닿지 않는 곳에 보관하십시오.,
85,K-008123,199902599,미래나프록센나트륨정,미래제약(주),"이 약은 류마티양 관절염, 골관절염(퇴행성 관절질환), 강직성 척추염, 건염(힘줄염), 급성통풍, 월경곤란증과 활액(윤활)낭염, 골격근장애(염좌(삠), 좌상(타박상), 외상(상처), 요천통(허리통증)), 수술후 동통(통증), 편두통, 발치(이를 뽑음)후 통증에 사용합니다.","류마티양 관절염, 골관절염, 강직성 척추염에 성인은 1회 1~2정(275~550 mg), 1일 2회(12시간마다), 급성통풍에는 초회량(처음 복용량)으로 3정(825 mg) 복용하고 발작이 없어질때까지 8시간 간격으로 1정(275 mg)을 복용, 골격근장애, 수술후 동통(통증), 발치(이를 뽑음)후 동통(통증), 월경곤란증, 건염(힘줄염), 활액(윤활)낭염에는 초회량(처음 복용량)으로 2정(550 mg)을 복용한 후 6~8시간간격으로 1정(275 mg)씩 복용하고 1일 총용량이 5정(1,375 mg)을 초과하지 않도록 합니다. 편두통에는 초회량(처음 복용량)으로 3정(825 mg)을 복용하고 필요하면 1일 1~2정(275~550 mg)을 더 복용할 수 있으며 초회량(처음 복용량)의 복용 30분 후에 복용합니다. 1일 총용량이 5정(1,375 mg)을 초과하지 않도록 합니다.",,"이 약에 과민증 환자, 소화성궤양, 심한 혈액이상, 심한 간장애, 심한 심기능부전, 심한 신장애, 심한 고혈압, 아스피린 등 비스테로이드성 소염진통제에 과민증 환자, 아스피린이나 다른 비스테로이드성 소염진통제(COX-2 저해제 포함)에 의하여 천식, 비염(코염), 코의 용종, 두드러기, 알레르기 반응 또는 경험자, 관상동맥(심장동맥) 우회로술 전후에 발생하는 통증의 치료 및 갈락토오스 불내성, Lapp 유당분해효소 결핍증 또는 포도당-갈락토오스 흡수장애 등의 유전적인 문제가 있는 환자는 이 약을 복용하지 마십시오. 이 약을 복용하기 전에 소화성궤양 경험자, 혈액이상 경험자, 출혈경향이 있는 환자, 간장애 또는 경험자, 신장애 또는 경험자, 심기능장애, 고혈압, 기관지천식, 전신성홍반성루푸스 및 혼합결합조직질환 환자, 고령자는 의사 또는 약사와 상의하십시오.","다른 비스테로이드성 소염진통제 및 나프록센 유도체, 아스피린, 고용량의 메토트렉세이트와 함께 복용하지 마십시오.","심근경색증 및 뇌졸중의 위험 증가, 위장관의 출혈, 궤양 및 천공(뚫림) 등 치명적일 수 있는 중대한 위장관계 이상반응, 드물게 쇽 증상(호흡곤란, 혈압강하, 서맥(느린 맥), 식은땀, 부기), PIE증후군(호산구증가를 수반하는 폐침윤 : 발열, 숨을 쌕쌕거림, 기침, 가래를 동반함), 두드러기, 때때로 발진, 가려움 등의 과민증상, 토혈(혈액구토), 위장출혈, 소화성궤양, 천공, 무균성 수막염(심한 두통, 구역, 구토, 불면, 목이 뻣뻣함, 발열 또는 의식장애), 습진, 땀이 남, 자반(자주색 반점), 광과민증, 탈모, 발적(충혈되어 붉어짐), 괴사성용해, 다형성홍반(여러 모양의 붉은 반점), 스티븐스-존슨증후군(피부점막안증후군), 두드러기, 표피 수포증, 드물게 무과립구증, 호산구증가, 백혈구감소, 혈소판감소, 재생불량성빈혈, 용혈성(적혈구파괴성)빈혈, 혈소판기능저하(출혈시간의 연장) 등의 혈액장애 등이 나타나는 경우 복용을 즉각 중지하고 의사 또는 약사와 상의하십시오. 때때로 위부불쾌감, 위통, 복통, 구역, 구토, 식욕부진, 소화불량, 가슴쓰림, 설사, 변비, 구내염(입안염), 드물게 복부팽만감, 흑변, 구갈, GOT, GPT 수치의 상승, 황달, 간염, 신장애, 신장염, 혈뇨, 고칼륨혈증, 간질성신염, 신증후군, 신장(콩팥) 유두괴사, 단백뇨(단백질이 섞인 오줌), 신부전, 귀울림, 청각장애, 시각장애, 부기, 호흡곤란, 심계항진(두근거림), 근무력증(근육무력증), 울혈성심부전, 호산구성 폐렴, 아나필락시양 반응, 월경장애, 오한(춥고 떨리는 증상)과 발열, 혈관염, 고혈당, 저혈당 등이 나타날 수 있습니다.",실온에서 보관하십시오. 어린이의 손이 닿지 않는 곳에 보관하십시오.,
86,K-008204,199903179,씨씨본정,(주)휴온스,"이 약은 위십이지장궤양, 위염, 위산과다의 제산작용 및 증상의 개선과 칼슘보급에 사용합니다.","위·십이지장궤양, 위염, 위산과다에는 1일 2~10정(1~5 g)을 3~4회 분할 복용, 칼슘보급에는 1일 3~6정(1.5~3 g)을 1~2회 분할 복용합니다. 연령, 증상에 따라 적절히 증감합니다.",1일 최대 15정(7.5 g)을 초과하지 마십시오.,"중증 고칼슘혈증 및 중증 고칼슘뇨증, 부갑상선기능항진증 또는 갑상선기능저하증, 중증 신부전, 무산증 또는 위산 결핍증, 갈락토오스 불내성, Lapp 유당분해효소 결핍증 또는 포도당-갈락토오스 흡수장애 등의 유전적인 문제가 있는 환자는 이 약을 복용하지 마십시오. 이 약을 복용하기 전에 신장애, 심기능장애, 폐기능장애, 변비 환자는 의사 또는 약사와 상의하십시오. 정해진 용법과 용량을 잘 지키십시오. 어린이에게 투여할 경우 보호자의 지도 감독하에 투여하십시오. 2주 정도 복용하여도 증상의 개선이 없을 경우 복용을 즉각 중지하고 의사 또는 약사와 상의하십시오.","테트라시아클린계 항생물질을 함께 복용하지 마십시오. 비타민D, 티아지드계 이뇨제, 다른 약물을 함께 복용하는 경우 의사 또는 약사와 상의하십시오. 다량의 우유와 함께 복용 시 우유 알칼리 증후군(고칼슘혈증, 고질소혈증, 알카리증 등)이 나타날 수 있으므로 의사 또는 약사와 상의하십시오.","구역, 변비 또는 설사, 드물게 위산의 반동성 분비, 가려움증 등이 나타날 수 있습니다.",습기와 빛을 피해 실온에서 보관하십시오. 어린이의 손이 닿지 않는 곳에 보관하십시오.,
87,K-008537,199907335,한미알마게이트정,한미약품(주),"이 약은 위·십이지장궤양, 위염, 위산과다, 속쓰림, 구역, 구토, 위통, 신트림의 제산작용 및 증상의 개선에 사용합니다.",성인 및 12세 이상의 소아는 1회 2정(1 g)을 1일 3회 식후 30분~1시간에 씹어서 복용합니다. 필요시 취침 전에 1회 더 복용할 수 있습니다.,,"이 약에 과민증 환자, 알츠하이머병, 치질, 체액저류(부기), 임신중독증, 설사, 진단되지 않은 소화기관출혈 환자는 이 약을 복용하지 마십시오. 이 약을 복용하기 전에 신장애, 신체 허약자, 인 함량이 낮은 식이요법 실시자, 소화흡수장애가 있는 사람, 고령자, 혈액구토 또는 흑색대변 등과 같은 소화기관출혈 증상이 있는 환자, 임부 또는 임신하고 있을 가능성이 있는 여성 및 수유부는 의사 또는 약사와 상담하십시오. 정해진 용법과 용량을 잘 지키십시오. 어린이에게 투여할 경우 보호자의 지도 감독하에 투여하십시오. 2주정도 복용하여도 증상의 개선이 없을 경우 복용을 즉각 중지하고 의사 또는 약사와 상의하십시오.","이 약을 복용하는 동안 테트라사이클린계 항생제는 복용하지 마십시오. 이 약을 복용하기 전에 비스테로이드소염(항염)진통제, 궤양치료제, 디기탈리스 제제, 클로르프로마진, 란소프라졸, 프레드니솔론, 페니실린, 퀴놀론, 철(Fe)염 제제, 살리실산염을 복용하는 환자는 의사 또는 약사와 상의하십시오.","변비, 설사 등이 나타나는 경우 복용을 즉각 중지하고 의사 또는 약사와 상의하십시오.",습기와 빛을 피해 실온에서 보관하십시오. 어린이의 손이 닿지 않는 곳에 보관하십시오.,
88,K-008826,200000744,아웃콜캡슐,정우신약(주),"이 약은 감기의 여러 증상(콧물, 코막힘, 재채기, 인후통, 기침, 가래, 오한(춥고 떨리는 증상), 발열, 두통, 관절통, 근육통)의 완화에 사용합니다.","만 15세 이상 및 성인은 1회 2캡슐씩, 1일 3회 식후 30분 이내에 복용합니다.","매일 세잔 이상 정기적 음주자가 이 약 또는 다른 해열진통제를 복용할 때는 의사 또는 약사와 상의하십시오. 간손상을 일으킬 수 있습니다. 매우 드물게 치명적일 수 있는 급성전신발진고름물집증, 스티븐스- 존슨증후군, 독성표피괴사용해와 같은 중대한 피부반응이 보고되었고 이 약 복용 후 피부발진 또는 다른 과민반응의 징후가 나타나는 경우 즉시 복용을 중단하십시오. 아세트아미노펜으로 일일 최대 용량(4,000 mg)을 초과하여 복용하지 마십시오. 간손상을 일으킬 수 있습니다. 아세트아미노펜을 포함하는 다른 제품과 함께 복용하지 마십시오. 급성전신발진고름물집증과 같은 중증 피부 이상반응이 나타나는 경우 복용을 중단하고 의사 또는 약사와 상의하십시오.","이 약을 복용하기 전에 수두 또는 인플루엔자에 감염되어 있거나 또는 의심되는 영아 및 만 15세 미만의 어린이, 슈도에페드린 성분과 관련하여 허혈성 대장염의 증상(예: 급격한 복통, 직장 출혈 등)이 발현될 경우, 알레르기 체질, 약에 의한 알레르기 증상(예: 발열, 발진, 관절통, 천식, 가려움증 등) 경험자, 간장질환, 신장(콩팥)질환, 심장질환, 갑상선질환, 당뇨병, 고혈압, 부종, 위십이지장궤양, 녹내장(예: 눈의 통증, 눈이 침침함 등), 배뇨(소변을 눔)곤란 등이 있는 사람, 고령자, 몸이 약한 사람 또는 고열이 있는 사람, 속쓰림, 위부불쾌감, 위통과 같은 위장문제가 지속 혹은 재발되거나 궤양, 출혈문제를 가지고 있는 사람, 임부 또는 임신하고 있을 가능성이 있는 여성 및 수유부, 흡연, 천식, 만성 기관지염, 폐기종, 과도한 가래가 동반되는 기침, 1주 이상 지속 또는 재발되는 기침, 만성 기침, 발열ㆍ발진이나 지속적인 두통이 동반되는 기침 환자, 황색5호 과민증 또는 알레르기 반응 경험자는 의사 또는 약사와 상의하십시오. 5~6회 복용하여도 증상의 개선이 없을 경우 복용을 즉각 중지하고 의사 또는 약사와 상의하십시오. 정해진 용법과 용량을 잘 지키십시오. 어린이에게 투여할 경우 보호자의 지도 감독하에 투여하십시오. 복용 후 졸음이 나타날 수 있으므로 운전 및 기계조작 시 주의하십시오.","진해(기침을 그치게 함)거담제(가래약), 다른 감기약, 해열진통제, 진정제, 항히스타민제를 함유하는 내복약(비염용 경구제, 멀미약, 알레르기용약)과 함께 복용하지 마십시오. 바르비탈계 약물, 삼환계 항우울제, 알코올, 칼륨함유제제, 감초함유제제, 글리시리진산 또는 그 염류함유제제, 루프계 이뇨제(푸로세미드, 에타크린산) 또는 티아지드계 이뇨제(트리클로르메티아지드)와 함께 복용 시 의사 또는 약사와 상의하십시오. 복용 중에는 음주하지 마십시오.","발진·발적, 가려움, 구역·구토, 식욕부진, 변비, 부종, 배뇨곤란, 목마름(지속적이거나 심한), 어지러움, 불안, 떨림, 불면, 드물게 쇽 증상(복용 후 바로 두드러기, 부종, 가슴답답합 등과 함께 안색이 창백하고, 손발이 차고, 식은땀, 숨쉬기 곤란함 등), 천식, 전신의 나른함, 황달, 간질성폐렴(기침을 동반하고, 숨이 차고, 호흡곤란, 발열 등), 위알도스테론증(요량 감소, 얼굴과 손발이 붓고, 눈꺼풀이 무거워지고, 손이 굳어지고, 혈압이 높아지거나 두통 등), 근병증(무력감, 사지경련, 마비) 등이 나타나는 경우 복용을 즉각 중지하고 의사 또는 약사와 상의하십시오.",습기와 빛을 피해 실온에서 보관하십시오. 어린이의 손이 닿지 않는 곳에 보관하십시오.,
89,K-008868,200001102,샤이닝정,동화약품(주),"이 약은 위장관계 질환의 발작성 동통(통증) 또는 담도계(쓸개길), 비뇨기계, 월경곤란증 등 여성 생식기계의 기능장애 및 경련성 동통(통증)에 사용합니다.",성인은 1회 1~2정 1일 3회 복용합니다. 1일 최대용량은 6정을 초과하지 마십시오.,"매일 세잔 이상 정기적 음주자가 이 약 또는 다른 해열진통제를 복용할 때는 의사 또는 약사와 상의하십시오. 간손상을 일으킬 수 있습니다. 아세트아미노펜으로 일일 최대 용량(4,000mg)을 초과하여 복용하지 마십시오. 간손상을 일으킬 수 있습니다. 아세트아미노펜을 포함하는 다른 제품과 함께 복용하지 마십시오.","이 약에 의한 과민증(발진, 붉은 반점, 가려움, 후두, 눈꺼풀, 입술 등의 부종)의 경험자, 다른 감기약 또는 해열진통제에 의한 천식 경험자, 심한 증상 신장애, 글루코스-6-인산탈수소효소 결핍증 환자, 녹내장, 전립선비대증, 유문협착(유문 좁아짐), 마비성장폐색(창자막힘증) 환자, 근육무력증, 거대결장 환자, 빠른 부정맥 환자, 갈락토오스 불내성, Lapp 유당분해효소 결핍증 또는 포도당-갈락토오스 흡수장애 등의 유전적인 문제가 있는 환자는 이 약을 복용하지 마십시오. 이 약을 복용하기 전에 간기능장애, 길버트증후군(모일렌그라하트증), 심한증상의 심질환, 심장동맥부전, 심부전 환자, 임신중(특히 임신초기 3개월 이내) 또는 수유부는 의사 또는 약사와 상의하십시오. 운전 및 기계조작 시 주의하십시오.","아세트아미노펜을 포함하는 다른 제품, 바르비탈계 약물, 삼환계 항우울약 및 알코올을 투여한 환자, 항전간제, 리팜피신과 함께 이 약을 복용하지 마십시오. 항히스타민제, 퀴니딘, 아만타딘, 디소피라미드, 메토클로프라미드와 같은 항도파민약, β-효능약, 프로판텔린, 클로람페니콜, 경구용 항응고약, 지도부딘과 함께 복용 시 의사 또는 약사와 상의하십시오.","혈소판감소증, 과립구감소증, 청색증, 백혈구감소증, 전체혈구감소증, 구역, 구토, 식욕부진, 변비, 목마름, 배뇨(소변을 눔)장애, 동공확대, 모양근마비, 홍조, 어지러움, 불안, 흥분, 환각, 기립성 저혈압, 발진, 빠른맥, 이상고열 등이 나타날 수 있습니다. 퀸케부종, 호흡곤란, 발한, 구역, 혈압저하, 쇽, 발적(충혈되어 붉어짐), 발진 등의 피부증상, 두드러기, 부기(후두, 눈꺼풀, 입술 등), 가슴답답함 등과 함께 안색이 창백해지고, 수족이 차가워지고 식은땀, 숨가쁨, 고열동반한 발진, 화상모양 수포, 천식이 나타나는 경우 복용을 즉각 중지하고 의사 또는 약사와 상의하십시오.",실온에서 보관하십시오.,
90,K-008900,200001305,복합탈시드츄어블정,(주)한독,"이 약은 속쓰림, 위부불쾌감, 위통, 위산과다, 구역, 구토, 위부팽만감, 위체, 신트림에 사용합니다.",만 15세 이상 소아 및 성인은 1회 1정 1일 3회 식전 또는 식간의 공복시에 씹어서 복용하거나 입안에서 녹여서 복용합니다.,이 약은 체내에서 페닐알라닌으로 대사되는 아스파탐이 함유되어 페닐알라닌의 섭취를 규제할 필요가 있는 페닐케톤뇨증 환자는 복용하지 마십시오.,"이 약에 과민증 환자, 투석요법을 받고 있는 환자 (장기투여에 의해 알루미늄뇨증, 알루미늄골증등이 나타날 수 있다.), 중증 신장애, 저인산혈증 환자, 만 15세 미만 소아는 이 약을 복용하지 마십시오. 이 약을 복용하기 전에 신장장애, 저인산염 식이 중인 환자, 심기능장애, 설사, 고마그네슘혈증, 임부는 의사 또는 약사와 상의하십시오. 정해진 용법과 용량을 잘 지키십시오.","글리코사이드계, 테트라사이클린계, 오플록사신 및 시프로플록사신등의 퀴놀론 유도체 및 케노데속시콜레이트, 대량의 우유 칼슘제제와 함께 복용하지 마십시오.","발진, 가려움, 때때로 식욕부진, 구역, 구토, 연변, 변비, 설사, 복통, 팽만감, 드물게 구갈, 위부 불쾌감, 안면홍조 등이 나타나는 경우 복용을 즉각 중지하고 의사 또는 약사와 상의하십시오.",습기와 빛을 피해 실온에서 보관하십시오. 어린이의 손이 닿지 않는 곳에 보관하십시오.,
